{
  "schema": "seloryn.agent-visible-transcript.v1",
  "run_id": "TOKEN-AGENT-01",
  "task_id": "tokenization-documentation-validation",
  "condition": "public-synthetic-fixture",
  "capture_scope": "synthetic_visible_messages_only",
  "messages": [
    {
      "role": "user",
      "text": "Count the visible units in these fixed public strings: hello world, caractere por caractere, and Tensor[F32, shape=[2, 2]]. Report Unicode code points, UTF-8 bytes, and model-specific BPE tokens. Do not infer provider billing or hidden context."
    },
    {
      "role": "assistant",
      "text": "Synthetic public fixture completed. The measurement keeps Unicode code points, UTF-8 bytes, and model-specific BPE tokens as separate fields. It covers visible text only and does not represent provider billing or hidden context."
    }
  ]
}
